"group_id";"admin_id";"title";"details";"created_at";"updated_at"
2;83;"scrap jet";"All about scraping with Selenium and Javascript!";"2023-11-23 18:48:37";""
3;28;"linux rangers";"Promoting power user applets for all!";"2023-11-23 18:50:48";""
4;7;"Data Science Enthusiasts";"Exploring the latest trends and techniques in data science.";"2023-11-23 20:28:10";""
5;4;"Python Coders Club";"A community for Python enthusiasts to share knowledge and collaborate.";"2023-11-23 20:28:10";""
6;11;"Machine Learning Mastery";"Diving deep into machine learning algorithms and applications.";"2023-11-23 20:28:11";""
7;58;"Big Data Explorers";"Exploring the world of big data technologies and analytics.";"2023-11-23 20:28:12";""
8;32;"SQL Server Pros";"Connecting SQL Server professionals to discuss best practices and tips.";"2023-11-23 20:28:12";""
9;24;"R Stats and Analytics";"Discussing statistical analysis and data visualization using R.";"2023-11-23 20:28:13";""
10;50;"JavaScript Wizards";"For those passionate about JavaScript and its ecosystem.";"2023-11-23 20:28:13";""
11;70;"Cloud Computing Hub";"Exploring cloud computing platforms and services.";"2023-11-23 20:28:14";""
12;55;"AI Ethics Forum";"Discussing the ethical considerations of artificial intelligence.";"2023-11-23 20:28:15";""
13;30;"Blockchain Innovators";"Exploring the latest developments in blockchain technology.";"2023-11-23 20:28:16";""
14;37;"Data Engineering Experts";"Focusing on the engineering side of data: ETL, pipelines, and more.";"2023-11-23 20:28:16";""
15;39;"TensorFlow Explorers";"Delving into the world of TensorFlow and deep learning.";"2023-11-23 20:28:17";""
16;8;"Data Visualization Society";"Showcasing and discussing creative data visualization techniques.";"2023-11-23 20:28:17";""
17;28;"Java Developers Network";"A community for Java developers to exchange ideas and code.";"2023-11-23 20:28:18";""
18;28;"Kubernetes Koders";"Mastering the art of container orchestration with Kubernetes.";"2023-11-23 20:28:19";""
19;48;"Web Scraping Warriors";"Sharing tips and tricks for effective web scraping.";"2023-11-23 20:28:19";""
20;26;"Natural Language Processing Club";"Exploring the challenges and advancements in NLP.";"2023-11-23 20:28:20";""
21;7;"Cybersecurity Guild";"Discussing cybersecurity strategies and best practices.";"2023-11-23 20:28:21";""
22;71;"Quantum Computing Enthusiasts";"Exploring the future of quantum computing and algorithms.";"2023-11-23 20:28:21";""
26;3;"Pydantic warriors";"Finding the best validation solutions for your attributes.";"2023-11-24 16:03:59";""
